Names,Price,Before Promo,Main Photo,descriptions,About Phone,All Reviews,Ratings,Number of Ratings,category,SIM,Ram,Storage
"HONOR X6a Mobile Phone Unlocked, 6.5-Inch 90Hz Fullview Display, 4GB+128GB, 5200 mAh Long-lasting Battery, 50MP Triple Camera, Android 13, Sky Silver",5200,No Sale,https://m.media-amazon.com/images/I/61PaGqEFgnL._AC_SX679_.jpg,(Brand : Name HONOR)   (Operating : System Android 13.0)   (RAM : Memory Installed 4 GB)   (CPU : Model Snapdragon)   (Memory : Storage Capacity 4 GB)   (Screen : Size 6.57 Inches)   (Refresh : Rate 90 Hz),"6.56“ Fullview Display：The 6.56-inch 90Hz HONOR FullView Display provides an intimate and comfortable visual experience all day long. HONOR X6a delivers an immersive visual experience, no matter when the user is working, streaming videos, or gaming, 50MP Triple Camera：HONOR X6a features an impressive ultra-clear Triple camera system comprising a 50MP Main Camera, a 2MP Macro Camera, and a 2MP Depth Camera, allowing users to capture their memorable life moments in vivid detail, Long Battery Life：Featuring a 5200 mAh battery, HONOR X6a can support up to 37 hours of audio calls or 26 hours of music on a full charge. With 22.5W HONOR SuperCharge, can charge to 31% in 20 minutes, fast and stable, Google Mobile Services：The smooth performance of MagicUI 7.1 is based on Android 13. With all Google apps and Google Play, it brings everything you need, 128 GB Large Storage Capacity：HONOR X6a can keep over 28,000 pictures, 11,000 songs or 450 HD videos locally. The MicroSD card slot allows users to further expand storage by up to 1TB, bringing enhanced flexibility to meet their business and personal needs",(المتسبب في تبادل الشحنه حسبي الله ونعم الوكيل)   (جهاز مناسب من ناحية السعر ومن ناحيه انه جهاز عملي)   (perfect As a gift)   ( decent quality)   ( amazing features.)   (👍🏻👍🏻👍🏻)   (جميل)   (لاصحاب الدخل المحدود او لطفل لسه صغير وخايف تشيله جوال غالي اظنه يفي بالغرض تماما التصوير جيد جدا مقارنة بالسعر ويوجد كل الخدمات الموجودة باي جهاز سامسونج عادي وشحنه سريع والانترنت مايقطع),4.2 out of 5 stars,40 ratings,phone,[],['4'],['128']
Xiaomi POCO C65 8-256 Blue,7099,No Sale,https://m.media-amazon.com/images/I/513DQGmivPL._AC_SX679_.jpg,"(Brand : Name Xiaomi)   (Operating : System MIUI 14 for POCO, based on Android 12)   (Memory : Storage Capacity 256 GB)   (Screen : Size 6.74 Inches)   (Wireless : Network Technology LTE)   (Model : Year 2024)","USA MARKET ONLY WORK ON TMOBILE MINT TELLO OR ANY UNDER TMOBILE NETWORK. ,OUTSIDE USA WORKS ANY GSM CARRIER SIM GSM FCC ID: 2AFZZCA4G, Dual sim + Micro SD Slot : 4G: LTE FDD: 1/2/3/4/5/7/8/20/28/66 4G: LTE TDD: 38/40/41 - 3G: 2/4/5/8 2G Quad Band, 6.74"" Dot Drop display1600x720, 260 ppiBrightness: 450 nits (typ), 600 nits HBMRefresh rate: Up to 90HzSupports Reading modeDC dimmingCorning Gorilla Glass screenTÜV Rheinland Low Blue Light certification (Software Solution)TÜV Rheinland Flicker Free certification*The refresh rate can be adjusted to up to 90Hz for supported apps.",(Na caixa vêm completo)   ( menos a capinha. O celular é bom no seu dia dia e não irá travar ( com o processador hélio G85 ))   ( 256 gigas de memória e 8g de ram. Nós jogos o celular roda: COD mobile)   ( dead cells)   ( Roblox e Minecraft. Tem entrada para 2 Chips e 1 cartão de memória. A sua resistência boa. Com sua tela de 90hz e sua bateria de 5000mAh.)   (La calidad del móvil Poco C65 a tan bajo precio es insuperable)   (Llego antes y el telefono esta muy bien. Si lo recomiendo)   (Dalle prime impressioni telefono valido e risponde bene)   (Mon smartphone a dépassé mes attentes)   ( je suis ravie de mon achat : la couleur me plaît beaucoup)   ( facil à utiliser. Je viens juste de le recevoir)   ( mais je suis très contente 😍😍),4.6 out of 5 stars,"1,355 ratings",phone,[],[],[]
"Xiaomi Redmi Note 12s (Blue 8GB RAM, 256 Storage) - 90Hz FHD+ AMOLED DotDisplay |MediaTek Helio G96 processor | 108MP pro-grade main camera | 33W fast charging 5000mAh, Bluetooth, Wi-Fi",9999,No Sale,https://m.media-amazon.com/images/I/814twV1phHL._AC_SY879_.jpg,(Brand : Name Xiaomi)   (Operating : System Android 10.0)   (RAM : Memory Installed 8 GB)   (CPU : Speed 2.05 GHz)   (Memory : Storage Capacity 256 GB)   (Screen : Size 6.43 Inches),"Brand: Xiaomi Camera description: Front Display type: Amoled Form factor: Slate Model name: Redmi Note 12S, Brand: Xiaomi., Model name: Redmi Note 12S, Operating system: Android 100, Display Size: 643 inches",(التليفون جميل و التوصيل سريع)   (موبايل اكبر من سعره . كاميرا عالية مساحة كبيرة رام كبير .. تقييمه جيد جداً بالنسبالي)   (ممتاز عن تجربه)   (جيد)   (ضمان محلي ولا دولي)   (i use this mobile only 1 month battry not good and also very slow)   (Waste of time i need my refund right away 😒),3.9 out of 5 stars,17 ratings,phone,[],['8'],['256']
"realme 12 Pro+ 5G (Navigator Beige, 8GB RAM, 256GB Storage)",17750,No Sale,https://m.media-amazon.com/images/I/716Td9LCF3L._AC_SX679_.jpg,,"☆【RAM, ROM And Expandable】:- 8GB RAM || 256GB ROM || Up to 16 GB RAM, 8 GB+ 8 GB Dynamic RAM, Seamlessly multitask with an impressive 8GB + 8GB of Dynamic RAM & enjoy ample space for photos, videos & documents with up to 256 GB of storage. The DRE dynamic memory expansion technology allows you to convert ROM into RAM, enhancing smartphone's performance ||In The Box: realme 12 Pro+ 5G, USB Type-C Cable, 67W Adapter, Protect Case, SIM Card Needle, Screen Protect Film, Quick Guide., ☆【Display】:- 17.02 cm (6.7 inch) Full HD+ Display || 120 Hz Curved Vision OLED display! The swift 16× HyperPrecise Touch ensures lightning-fast & accurate responses, while ProXDR restores HDR's full dynamic range for unparalleled photo viewing. With 2160 Hz PWM dimming & AI brightness adjustment for superior visual comfort, this display is an eye-friendly treat. The sleek 2.32 mm Ultra Narrow Chin, rugged Double-reinforced Glass & HyperVision Mode contribute to an ergonomic & immersive delight., ☆【Camera】:- 50MP + 8MP + 64MP | 32MP Front Camera || 50MP Primary Camera (f/1.88 Aperture, Sony IMX890, 1/1.56 inch Sensor Size, 1.0um Pixel Size + 8MP Wide Angle Camera (f/2.2 Aperture, Hynix Hi846W, 1/4 inch Sensor Size, 1.12um Pixel Size + 64MP Telescopic Camera (f/2.46 Aperture, OmniVision OV64B40, 1/2 inch Sensor Size, 0.702um Pixel Size. Camera Feature: Photo, Video, Night, Street, Pro || 32MP Front Camera Setup: (f/2.4 Aperture, Sony IMX615, 1/2.74 inch Sensor Size, 0.8um Pixel Size, ☆【Processor】:- Snapdragon 7s Gen 2 Processor || Snapdragon 7s Gen 2 5G Chipset, Powered by the Qualcomm Snapdragon 7s Gen2, the realme 12 Pro+ 5G stands out with the only 4 nm Snapdragon chipset in its segment with 5G compatibility. This smartphone guarantees powerful performance, ensuring the smooth completion of all your tasks. Enjoy lag-free gaming, seamless multitasking, and lightning-fast connectivity with this cutting-edge chipset., ☆【Battery】:- 5000 mAh Battery || Power up at lightning speed with the 67 W SUPERVOOC Charge and revel in extended usage with the robust 5000 mAh battery. Stay connected longer with reduced wait times. The dual charge pump technology and intelligent five-core chip protection ensure optimal charging efficiency and top-tier device safety., ☆【12 GB+12 GB Dynamic RAM】:- Seamlessly multitask with an impressive 12 GB + 12 GB of Dynamic RAM and enjoy ample space for photos, videos, and documents with up to 256 GB of storage. The DRE dynamic memory expansion technology allows you to convert ROM into RAM, enhancing the smartphone's overall performance., ☆【50 MP Sony IMX890 OIS Camera】:- Embark on a photography revolution with the realme 12 Pro+ 5G's pioneering 50 MP Sony IMX890 OIS Camera. Boasting the largest sensor in its price segment, this camera delivers unmatched HDR and nightscape brilliance. Bid farewell to blur with SuperOIS, while the Ultra Clarity Engine and DIS Engine ensure precision beyond compare. Capture moments with unprecedented clarity and elevate your photography game to new heights.",(Best camera phone)   (Periscope portrait is awesome.  Camera is really awesome in this price range.  Overall performance is smooth.  Fast charging is also available),4.1 out of 5 stars,6 ratings,phone,[],['8'],['256']
"Infinix Hot 40i (RAM: 8+8GB, ROM: 256GB), 6.6"" HD+ Display, 50MP Dual AI Rear Camera, 32MP Crystal-Clear Front Camera, 5000 mAh Battery With 18W Fast Charge - Horizon Gold Color",6110,No Sale,https://m.media-amazon.com/images/I/61gcS+bE3fL._AC_SX679_.jpg,(Brand : Name Infinix)   (Operating : System Android 13.0)   (RAM : Memory Installed 8 GB)   (CPU : Model 1.2GHz Cortex A13 Processor)   (Memory : Storage Capacity 256 GB)   (Screen : Size 6.56 Inches)   (Resolution : 720 x 1612),"50MP Dual AI Cam +32MP Crystal-Clear Selfie, Up to 16GB Extended RAM+256 GB Storage, 18W FastCharge +5000mAh Long-Lasting Power, 90Hz Super Fluid Punch-Hole Screen with Magic Ring + Side-Mounted Fingerprint Unlock, Octa-Core Chipset with XBOOST Gaming Engine",(جهاز بسعر منخفض وميزات جميله وسرعة بالاداء)   (المنتج ممتاز و الماركة واعدة و تعتبر من أفضل الماركات الصيني)   (Very very nice)   (ممتاز)   (Sim 1 defect issues…),4.2 out of 5 stars,15 ratings,phone,['Dual'],['8'],['256']
"realme 12 Pro+ 5G (Navigator Beige, 8GB RAM, 256GB Storage)",17750,No Sale,https://m.media-amazon.com/images/I/716Td9LCF3L._AC_SX679_.jpg,,"☆【RAM, ROM And Expandable】:- 8GB RAM || 256GB ROM || Up to 16 GB RAM, 8 GB+ 8 GB Dynamic RAM, Seamlessly multitask with an impressive 8GB + 8GB of Dynamic RAM & enjoy ample space for photos, videos & documents with up to 256 GB of storage. The DRE dynamic memory expansion technology allows you to convert ROM into RAM, enhancing smartphone's performance ||In The Box: realme 12 Pro+ 5G, USB Type-C Cable, 67W Adapter, Protect Case, SIM Card Needle, Screen Protect Film, Quick Guide., ☆【Display】:- 17.02 cm (6.7 inch) Full HD+ Display || 120 Hz Curved Vision OLED display! The swift 16× HyperPrecise Touch ensures lightning-fast & accurate responses, while ProXDR restores HDR's full dynamic range for unparalleled photo viewing. With 2160 Hz PWM dimming & AI brightness adjustment for superior visual comfort, this display is an eye-friendly treat. The sleek 2.32 mm Ultra Narrow Chin, rugged Double-reinforced Glass & HyperVision Mode contribute to an ergonomic & immersive delight., ☆【Camera】:- 50MP + 8MP + 64MP | 32MP Front Camera || 50MP Primary Camera (f/1.88 Aperture, Sony IMX890, 1/1.56 inch Sensor Size, 1.0um Pixel Size + 8MP Wide Angle Camera (f/2.2 Aperture, Hynix Hi846W, 1/4 inch Sensor Size, 1.12um Pixel Size + 64MP Telescopic Camera (f/2.46 Aperture, OmniVision OV64B40, 1/2 inch Sensor Size, 0.702um Pixel Size. Camera Feature: Photo, Video, Night, Street, Pro || 32MP Front Camera Setup: (f/2.4 Aperture, Sony IMX615, 1/2.74 inch Sensor Size, 0.8um Pixel Size, ☆【Processor】:- Snapdragon 7s Gen 2 Processor || Snapdragon 7s Gen 2 5G Chipset, Powered by the Qualcomm Snapdragon 7s Gen2, the realme 12 Pro+ 5G stands out with the only 4 nm Snapdragon chipset in its segment with 5G compatibility. This smartphone guarantees powerful performance, ensuring the smooth completion of all your tasks. Enjoy lag-free gaming, seamless multitasking, and lightning-fast connectivity with this cutting-edge chipset., ☆【Battery】:- 5000 mAh Battery || Power up at lightning speed with the 67 W SUPERVOOC Charge and revel in extended usage with the robust 5000 mAh battery. Stay connected longer with reduced wait times. The dual charge pump technology and intelligent five-core chip protection ensure optimal charging efficiency and top-tier device safety., ☆【12 GB+12 GB Dynamic RAM】:- Seamlessly multitask with an impressive 12 GB + 12 GB of Dynamic RAM and enjoy ample space for photos, videos, and documents with up to 256 GB of storage. The DRE dynamic memory expansion technology allows you to convert ROM into RAM, enhancing the smartphone's overall performance., ☆【50 MP Sony IMX890 OIS Camera】:- Embark on a photography revolution with the realme 12 Pro+ 5G's pioneering 50 MP Sony IMX890 OIS Camera. Boasting the largest sensor in its price segment, this camera delivers unmatched HDR and nightscape brilliance. Bid farewell to blur with SuperOIS, while the Ultra Clarity Engine and DIS Engine ensure precision beyond compare. Capture moments with unprecedented clarity and elevate your photography game to new heights.",(Best camera phone)   (Periscope portrait is awesome.  Camera is really awesome in this price range.  Overall performance is smooth.  Fast charging is also available),4.1 out of 5 stars,6 ratings,phone,[],['8'],['256']
"Infinix Hot 40i (RAM: 8+8GB, ROM: 256GB), 6.6"" HD+ Display, 50MP Dual AI Rear Camera, 32MP Crystal-Clear Front Camera, 5000 mAh Battery With 18W Fast Charge - Horizon Gold Color",6110,No Sale,https://m.media-amazon.com/images/I/61gcS+bE3fL._AC_SX679_.jpg,(Brand : Name Infinix)   (Operating : System Android 13.0)   (RAM : Memory Installed 8 GB)   (CPU : Model 1.2GHz Cortex A13 Processor)   (Memory : Storage Capacity 256 GB)   (Screen : Size 6.56 Inches)   (Resolution : 720 x 1612),"50MP Dual AI Cam +32MP Crystal-Clear Selfie, Up to 16GB Extended RAM+256 GB Storage, 18W FastCharge +5000mAh Long-Lasting Power, 90Hz Super Fluid Punch-Hole Screen with Magic Ring + Side-Mounted Fingerprint Unlock, Octa-Core Chipset with XBOOST Gaming Engine",(جهاز بسعر منخفض وميزات جميله وسرعة بالاداء)   (المنتج ممتاز و الماركة واعدة و تعتبر من أفضل الماركات الصيني)   (Very very nice)   (ممتاز)   (Sim 1 defect issues…),4.2 out of 5 stars,15 ratings,phone,['Dual'],['8'],['256']
"Redmi Note 13 (Ocean Sunset 8GB RAM, 256 Storage) - Super-clear 108MP triple camera |120Hz FHD+AMOLED display | Immersive viewing with ultra-thin bezels | Secure in-screen fingerprint sensor",8749,No Sale,https://m.media-amazon.com/images/I/51-nnAA6T2L._AC_SX679_.jpg,(Brand : Name Xiaomi)   (Operating : System MIUI 12)   (RAM : Memory Installed 8 GB)   (CPU : Model Snapdragon)   (Memory : Storage Capacity 256 GB)   (Screen : Size 6.67 Inches)   (Model : Name Redmi Note 13),"Super-clear 108MP triple camera, 120Hz FHD+AMOLED display, Immersive viewing with ultra-thin bezels, Secure in-screen fingerprint sensor, Powerfu Snapdragon? performance",(Produto bonito)   ( perfeito pelo preço)   ( bateria segura bem )   ( atendeu alem das expectativas)   (muito bom o produto. excelente telefone . bem rapida a entrega)   (The product was delivered promptly)   ( and I have no regrets buying and using the product.)   (Ótimo produto)   ( veio bem embalado. Amei)   (easy to use android phone and very fast.),4.7 out of 5 stars,15 ratings,phone,[],['8'],['256']
"Samsung Galaxy Z Fold5 Folding Phone, Android Smartphone, 12GB RAM, 512GB Storage, Extended Battery Life, High Resolution Camera, Cream (UAE Version)",65950,No Sale,https://m.media-amazon.com/images/I/71Cx1wmgQlL._AC_SX679_.jpg,(Brand : Name SAMSUNG)   (Operating : System Android 10.0)   (RAM : Memory Installed 12 GB)   (CPU : Model Snapdragon)   (Memory : Storage Capacity 512 GB)   (Screen : Size 7.6 Inches)   (Resolution : 1080 x 2400),"Immersive main display: Unfold a stunning, immersive 7.6-inch screen designed to bring you a viewing experience like never before. With a redesigned Flex Hinge, this Samsung Galaxy Z Fold5 cell phone folds down tight for a secure grip., More productivity thanks to multi window: Stream, shop, browse and play more by managing three windows on a single screen. Effortless switch between apps, with a task bar that holds up to twelve at once. Partner up with S Pen for even more efficiency., Bright screen ultra clarity: Jump into the action with a bright screen emitting up to 1750 nits for clear visibility. Elevate your gaming performance with the upgraded hardware and software of Snapdragon 8 Gen 2 Mobile Platform for Galaxy., Cameras that turn your mobile phone into a mobile studio: With an advanced camera system, paired with this unique two-display form factor, including 30x Space Zoom, Dual Preview and Expert RAW you can shoot, reshoot, zoom and edit with a whole new level., Long-lasting battery life: Listen for up to 73 hours, watch for up to 21 hours. This reliable and powerful 4400mAh (typical) battery can keep up with your demanding lifestyle. Stay connected, entertained and productive without running out of battery.",(Purchased twice (two similar products)... Another level of using mobiles... 🥹 It is simply amazing...)   (I have been using the phone for 5 days now and it has been great. The best part is how clear the screens are)   ( outer and inner screens. The down part is the battery which can barely last almost a day (i.e. 20 hours). But overall)   ( the experience of using this phone has been fantastic whether for entrainment or productivity. I have no regrets in buying this phone.)   (Great phone)   (i was worried if the warranty will be applicable and the differences between international and uae version. but it turned out nice)   (The phone feels pretty solid using it for 5 days now. Battery life is not that great but all the rest scream of a top notch phone.),5.0 out of 5 stars,8 ratings,phone,[],['12'],['512']
Oppo A79 5G Dual-SIM 256GB ROM + 8GB RAM (Only GSM | No CDMA) Factory Unlocked 5G Smartphone (Mystery Black) - International Version,10450,No Sale,https://m.media-amazon.com/images/I/71Fbf9Obn1L._AC_SX522_.jpg,,"OPPO, Oppo A79 5G Dual-SIM 256GB ROM + 8GB RAM (Only GSM | No CDMA) Factory Unlocked 5G Smartphone (Mystery Black) - International Version, CELLULAR_PHONE",(Immediately getting hot. Feeling bad...),3.5 out of 5 stars,3 ratings,phone,['Dual'],['8'],['256']
"Samsung Galaxy A34 5G (Awesome Lime, 8GB, 256GB Storage) | 48 MP No Shake Cam (OIS) | IP67 | Gorilla Glass 5 | Voice Focus | Travel Adapter to be Purchased Separately",13850,No Sale,https://m.media-amazon.com/images/I/712f4xV-Z3L._AC_SX522_.jpg,(Brand : Name SAMSUNG)   (Operating : System Android 13.0)   (RAM : Memory Installed 8 GB)   (CPU : Model Snapdragon)   (Memory : Storage Capacity 256 GB)   (Screen : Size 16.65 Centimeters)   (Resolution : 1080 x 2340),"48MP(OIS)+8MP+5MP Triple camera setup - 48MP (F1.8) Main Camera with OIS + 8MP (F2.2) Ultra wide camera + 5MP (F2.4) depth camera | 13MP (F2.2) front camera, 16.65 centimeters (6.6-inch) FHD+ Super AMOLED display, FHD+ resolution with 1080 x 2340 pixels , 393 PPI with 16M colours, Android 13, v13.0 operating system with MediaTek | MTK D1080 2.6GHz,2GHz Octa-Core processor, A34 5G has an IP67 certification and Gorilla Glass 5 (front screen) for carefree usage, Premium design experience with a metal camera deco",(لا يوجد فواتير حتى الان)   (يوجد خدوش على حواف الهاتف)   (Like camera )   ( excellent looking )   ( good battery )   ( excellent sound )   ( Dislike not supplying charger with the phone .)   (Sir)   ( I really like the product you sent. I got it in a sealed pack and with the receipt. I thank the seller and also thank Amazon.)   (As it is an Aseries phone)   ( I had high hopes on it but this is just a average phone. I moved from OnePlus 7 to this phone. Front camera is very bad and we can't even use it for face unlock. Fingerprint sensor works accurate but slow compared to OnePlus 7. Battery backup is average and I am guessing it is because of jio switching between 4G and 5G.  Night mode is not good)   ( photos has too much noise.  Apart from above concerns)   ( everything else is good)   (5 stat)   (it was Nice Phone and decent audio and picture quality . if you use continues 5g one day battery life. main problem is Type c Audio jack it will not support all type C connector you have to go Bluetooth earphone or Samsung type c earphone that is the main disadvantage.),4.2 out of 5 stars,262 ratings,phone,[],['8'],['256']
iPhone 13 128GB Midnight,29224.45,30394.00,https://m.media-amazon.com/images/I/61VuVU94RnL._AC_SX679_.jpg,(Brand : Name Apple)   (Operating : System iOS 15)   (RAM : Memory Installed 4 GB)   (Memory : Storage Capacity 128 GB)   (Screen : Size 6.1 Inches)   (Resolution : 2560 x 1440)   (Refresh : Rate 60 Hz),"6.1-inch Super Retina XDR display Cinematic mode adds shallow depth of field and shifts focus automatically in your videos, Advanced dual-camera system with 12MP Wide and Ultra Wide cameras; Photographic Styles, Smart HDR 4, Night mode, 4K Dolby Vision HDR recording, 12MP TrueDepth front camera with Night mode, 4K Dolby Vision HDR recording, A15 Bionic chip for lightning-fast performance",(تلفون ممتاز و جميل)   (sealed in new condition... i have been using it for 2 years now with no issue)   (التليفون اصلى وممتاز والبائع محترم جدا انصح به)   (لو بشرحتين يبقي كويس جدا)   (Amazing)   (لقيت تراب داخل العدسه والNFC مش موجود والاضدار هندي .. تجربه سيئه)   (It’s an unsealed device like used)   (شكرا عرض ممتاز وتاجر محترم)   (As expected)   ( excellent product. Delivery a day late)   ( otherwise very happy.)   (Mobile are legit and new)   (سعره مناسب)   (I am not a fond of I phone as I am using android long time. I buy this product for my Son (as a graduation gift) and send to Philippines. He just received the item today (Sent via LBC Air Cargo) and his so happy and saying quality is good as he is really an iphone user since then. I just want to say thanks to Amazon really never fails always making the customer worldwide fully satisfied.)   (As an avid Apple enthusiast)   ( the Apple iPhone 13 (128GB) in Midnight truly stands out as the pinnacle of smartphone innovation. This device not only meets but surpasses expectations)   ( showcasing impeccable performance thanks to its powerful processor. Its exceptional camera system captures moments with stunning clarity and detail)   ( whether it's everyday snapshots or professionalgrade photography. Apple's unwavering commitment to quality is evident in every aspect of the iPhone 13)   ( ensuring a seamless user experience without compromise. For those seeking unrivaled excellence in a smartphone)   ( the iPhone 13 undoubtedly sets the standard.),4.5 out of 5 stars,217 ratings,phone,[],[],['128']
"MI NOTE 12S 8GB RAM, 256 GB ROM - ONYX BLACK",8752.03,No Sale,https://m.media-amazon.com/images/I/61cKUEmKctL._AC_SX679_.jpg,(Brand : Name Xiaomi)   (Operating : System android 13.0)   (RAM : Memory Installed 8 GB)   (CPU : Model Snapdragon)   (Memory : Storage Capacity 256 GB)   (Screen : Size 6.43 Inches)   (Resolution : 1080 x 2400),"Android 13, MIUI 14, Mediatek MT6781 Helio G96 (12 nm), Li-Po 5000 mAh, non-removable, Fingerprint (side-mounted), accelerometer, gyro, proximity, compass",(منتج مختلف خالص عن اللي طالبه)   (لا يوجد اهتمام بخدمه التوصيل وخدمه العملاء فى حل المشكلات وتاخير الطلبات تم الطلب بتاريخ 29/11/2023 ولم يتم الاستلام حتى تاريخه)   (جميل جدا جدا ♥️♥️)   (Das Redmi Note 12S ist mit NFC ausgerüstet (entgegen der Mitteilungen ) und bringt alles mit sich was man braucht. Sehr gute Kamera)   ( flott in der Benutzung)   ( Fingerabdruck und Gesichtserkennung funktionieren einwandfrei. Den Akku habe ich mal außen vor gelassen weil ich das Handy erst einen Tag habe. Aber ich glaube das der Akku auch eine gute Kapazität hat. Ein tolles Smartphone für relativ wenig Geld. Außer das das entfernen der Werbung und etlicher Spiele und unnötigen Apps etwas Zeit gebraucht hat. Bei google gibt es Tutorials dazu wie man das am besten macht. Aber die sind nicht für Miu14 gedacht und es gibt einige Einstellungen gar nicht die da beschrieben sind. Aber das sind Kleinigkeiten die man bei diesem Preis und dieser Leistung verschmerzen kann. 5 Sterne für das Xiaomi Redmi Note 12 s)   (Très bon téléphone)   ( très belles photos Pratique Beau)   (telefon çok güzel fakat fatura talep etmemize rağmen fatura gönderilmedi)   (Va bien en todo. Me sorprendió el tamaño)   ( un pelín más pequeño del habitual)   ( lo cual se agradece. El resto de características muy bien)   ( buena memoria)   ( cámara decente....)   (Il pacco è arrivato in ottime condizioni)   ( l'articolo corrisponde perfettamente alla descrizione)   ( però è solo un giorno che ce l'ho quindi non posso giudicarlo pienamente)   ( sembra comunque molto performante)   ( veloce fluido e facile da usare)   ( sarà che oramai è il mio terzo telefono xiaomi redmi note),4.1 out of 5 stars,171 ratings,phone,[],['8'],['256']
