Names,Price,Before Promo,Main Photo,descriptions,About Phone,All Reviews,Ratings,Number of Ratings,category,SIM,Ram,Storage
"realme 12 Pro+ 5G Smartphone 12+512GB, Fotocamera Sony IMX890 OIS Zoom ottico 3X, Snapdragon 7s Gen 2, Display curvo Vision da 6,7"" a 120Hz, Ricarica SUPERVOOC da 67W, Batteria da 5.000mAh, blu",19557,No Sale,https://m.media-amazon.com/images/I/814Exq9+FmL._AC_SX679_.jpg,,"[Periscope Portrait Camera. Sony IMX890 OIS camera. MasterShot omnifocal algorithm], The latest generation imaging is not based on an incredibly high number of megapixels, but on the latest generation hardware and software. realme 12 Pro+ 5G contains within it our most advanced camera system ever, with the first periscope camera in the history of the digital series, the best Sony IMX890 OIS camera in the segment and the most advanced imaging algorithm in the industry., [Incredible brilliance. 120Hz curved display] Visual experience with flagship results. Admire the photos in all their brilliance. The Pro-XDR display captures the full dynamic range of HDR photos, ensuring flawless results. Vision protection when needed. The high-frequency PWM dimming of 2,160Hz will automatically activate in low light conditions., [Absolute power] The 4nm Snapdragon Processor offers incredible energy potential combined with reduced consumption, for an optimal, responsive and efficient experience in all circumstances. Highly efficient 4nm process. Octa-core CPU up to 2.4 GHz. Dual Carrier Aggregation Technology. AnTuTu benchmark score 660,000+., [A winning combination] Long-lasting 5,000mAh battery, 67W SUPERVOOC charging. Recharge from 1 to 50% in just 19 minutes, getting additional power when you need it most. The 3,394 mm² VC cooling system, which affects the motherboard's main heat sources, offers a dramatic increase in heat diffusion efficiency, [realme Design Studio x Ollivier Savéo] Following the watchmaking tradition of the 18th century, Ollivier Savéo brings to life designs with refined details, for a smartphone with perfect symmetry through hours and hours of work dedicated to carving, polishing and grinding, for a design which immediately captures attention.",(Phone’s camera is not working)   (Llevo meses ya con el tele y debo decir que estoy totalmente satisfecho con él. Va como un tiro)   ( no me ha dado ni un problema y la cámara es una maravilla. En cuanto a rendimiento)   ( ninguna queja. Lo mueve todo sin problemas)   ( incluso con muchas aplicaciones abiertas. De memoria va más que sobrado)   ( así que el hecho de no tener tarjeta de ampliación no me afecta. La cámara)   ( como he dicho)   ( es una pasada. Gran resolución)   ( muy configurable y con un zoom alucinante. El estabilizador funciona de maravilla también. El sonido es muy bueno también)   ( con el dolby. Las únicas pegas que le encuentro son que la vibración es muy suave y a veces no me entero cuando llega algo y está en ese modo)   ( que las notificaciones no suenan muy fuerte)   ( (aunque el tono de llamada sí))   ( y que al conectado al PC)   ( como todos los realme)   ( se pone a buscar fotos de forma automática y tardas un poco en poder manejarte entre las carpetas. Sin tres pujada)   ( pero por lo demás)   ( estoy encantado con el teléfono.)   (Ho provato questo smartphone poiché era molto apprezzato nella fascia di prezzo 300/400 Euro)   ( che è quella che mi intèressa. Ecco le mie impressioni dopo alcuni giorni di utilizzo:  **Design e Costruzione:** Il telefono si presenta bene e solido. Esteticamente)   ( non amo il comparto fotografico così invadente al centro)   ( ma sono solo gusti personali.  **Autonomia:** Arrivando da un Samsung S23 che non mi permetteva di terminare la giornata con una sola carica)   ( questo device è una piacevole sorpresa. Utilizzandolo intensamente)   ( riesce a coprire un'intera giornata senza problemi. Acceso dalle 8 di mattina)   ( arriva facilmente alle 23 con ancora un 1520% di carica residua e quasi 6 ore di schermo attivo.  **Prestazioni:** La fluidità è discreta e non presenta impuntamenti significativi. Le prestazioni generali sono adeguate per la fascia di prezzo.  **Fotocamera:** Il comparto fotografico sa il fatto suo)   ( anche nelle foto con scarsa illuminazione. Sebbene non sia il top di gamma)   ( le foto risultano comunque di buona qualità per un telefono di questa fascia.  **Connettività:** Ottimo il segnale telefonico; il dispositivo prende molto bene anche in posti dove i miei precedenti device stentavano a restare connessi.  **Display:** Il display è ottimo anche alla luce del sole)   ( rendendo facile l'utilizzo all'aperto.  **Ricarica:** Molto comoda la ricarica ultra veloce)   ( che in meno di un'ora abbondante porta la batteria al 100%.  **Punti di Critica:** Non sarebbe stato male se fosse stato un po' più leggero e magari più sottile)   ( ma non si può avere tutto. L'unico vero problema riscontrato è stato con il vivavoce: molti amici mi hanno detto che mi sentivano male)   ( anche con il telefono vicino alla bocca.  **Conclusioni:** Detto questo)   ( se l'estetica delle fotocamere vi piace)   ( è un telefono davvero tuttofare. Per la fascia di prezzo)   ( offre un ottimo rapporto qualitàprezzo e soddisfa le esigenze quotidiane con efficacia. Read more)   (Ottimo smartphone. Il sistema operativo è privo di bug. Il materiale con cui è costruito è molto buono. Lo schermo curvo pensavo desse fastidio e invece no. Le foto sono molto belle)   ( non perfette ma se la cava molto bene in ogni situazione. Batteria di lunga durata)   (Tutto perfetto 'unica pecca quando chiamo o mi chiamano l'audio mi sembra un po' basso)   ( qualcuno di voi a trovato lo stesso mio problema e se si come lì ha risolto?),4.4 out of 5 stars,73 ratings,phone,[],[],['512']
"Samsung Galaxy S23, 128GB, Green, UAE Version, 5G Mobile Phone, Dual SIM, Android Smartphone, 1 Year Manufacturer Warranty",32000,No Sale,https://m.media-amazon.com/images/I/61+ZCyxhYiL._AC_SX522_.jpg,(Brand : Name SAMSUNG)   (Operating : System Android 9.0)   (CPU : Model Snapdragon)   (Memory : Storage Capacity 128 GB)   (Screen : Size 6.1 Inches)   (Model : Name Galaxy S23)   (Wireless : Provider Unlocked for All Carriers),"Unbox the change you want to see in the world. Crafted with recycled glass and PET film and coloured with natural dyes, each phone is tucked into a box made of recycled paper and paper-based protective film, Get ready for a Gallery full of epic night shots everyone will want. Nightography's enhanced AI keeps details clear, so low light photos and videos will be bright and colourful from dusk to dawn and back again., The 50MP Wide-angle Camera works hand-in-hand with a powerful chip, rapidly combining frames to extract bits from each into a single hi-res photo. Add in Detail Enhancer technology and you've got quality so sharp; you'll keep zooming in for more., When stopping's not an option, this revolutionary chip powers your phone to deliver better gaming and video streaming, with extended battery life to carry you through the most epic of days., Call it a night? Nah. Game on and binge-watch your favourite shows with a long-lasting and fast-charging battery., Unbox the change you want to see in the world. Crafted with recycled glass and PET film and coloured with natural dyes, each phone is tucked into a box made of recycled paper and paper-based protective film","(I kinda like the size of the phone in my hand)   ( in a market that is filled with large phones this is one of the few phones that is this compact. The performance is snappy and and battery can last a whole day without charging. Camera is just decent but has hard time on low light conditions. The chipset in this phone (Snapdragon 8 gen 2) will have sufficient performance for a long time especially they are reaching the limit on how much they can improve the next generation. If you are looking for a compact phone that can last you for 5+ years or an alternative to iphone but android this is a safe bet.)   (me encanto mi celular el tamaño color y forma muy rápido carga rápida y viene liberado para cualquier compañía)   (Samsung s23)   (phone is as described in the listing ""as new""still had factory protection on would would recommend Secondhandphones.com👍)   (Vino en perfecto estado y va muy bien gracias a su gran procesador)   ( el unico pero que le pongo a la paqueteria por que se tardaron 3 días en entregarmelo fuera de eso todo bien)   (I really am pleased with my S23. I upgraded from an S20)   ( with which I was also very happy The S23 is an improvement on an already great phone. It's faster)   ( everything works as well or better than on the S20)   ( it has some new features that I really like)   ( and in general)   ( I'm completely satisfied and happy with my decision to upgrade. Price was right)   ( delivery ontime and the transition was nearly painless.)",4.4 out of 5 stars,129 ratings,phone,['Dual SIM'],[],['128']
realme C51 Dual SIM Carbon Black 4GB RAM 128GB 4G LTE,4950,No Sale,https://m.media-amazon.com/images/I/51byClcWXML._AC_SX679_.jpg,,"Original brand product, Brand: realme, Cellular technology: LTE, Model name: Realme C51, Operating system: Android 10.0, Display Size: 6.74 inches",(الجهاز عملي و بيقدم قيمة جيدة جدا مفابل سعر)   (كل شئ ممتاز والشحنه وصلتنى بحاله ممتازه والجهاز ما شاء الله جميل جدا واداءه فوق ما كنت اتوقع)   (جهاز جيد جدا حتي الآن لكن اعتقد هناك مشكلة في التوكيل لعدم وجود وكيل في مصر)   (Ho acquistato questo cellulare perchè lo aveva già preso mio nipote ed era assolutamente soddisfatto. A mia volta devo dire che il cellulare è bello)   ( grande)   ( semplice da usare ed ha un eccellente rapporto qualità prezzo quindi sull'articolo)   ( almeno al momento)   ( nulla da eccepire. Quello che è stato assolutamente negativo è il servizio fornito dal corriere che non è stato in grado di fornire un minimo di assistenza dopo la prima tentata consegna. Comunque)   ( come si dice)   ( tutto è bene ciò che finisce bene.)   (Nos llegó el smartphone en mal estado)   ( se apagaba todo el tiempo. Llevamos más de un mes intentando devolverlo y ni el vendedor ni Amazon responden.)   (Nulla da dire su questo prodotto ormai da me testato da parecchi mesi. Costa qui su Amazon)   ( come le grandi catene quando sono in offerta. Il prodotto è buono)   ( soprattutto per la spesa che si sta facendo. Lavora con Android.)   (Marito soddisfatto)   ( veniva da realme 7. Prezzo wow! Prestazioni molto buone.)   (un telefono molto funzionante e veloce risponde bene ai comandi e la durata della batteria è veramente eccezionale ve lo consiglio),4.0 out of 5 stars,23 ratings,phone,['Dual SIM'],['4'],['128']
"Apple iPhone 14 (128 GB) - Midnight, Bluetooth, Wi-Fi, USB",35950,No Sale,https://m.media-amazon.com/images/I/51sFkTjuc3L._AC_SX679_.jpg,(Brand : Name Apple)   (Operating : System iOS 16)   (RAM : Memory Installed 6 GB)   (CPU : Model A13)   (Memory : Storage Capacity 128 GB)   (Screen : Size 6.1 Inches)   (Resolution : 720 x 1600),"6.1-inch Super Retina XDR display Advanced camera system for better photos in any light, Cinematic mode now in 4K Dolby Vision up to 30 fps, Action mode for smooth, steady, handheld videos, Vital safety features ǨEmergency SOS via satellite and Crash Detection",(The phone serial is confirmed by apple as i check it before open the box. Original and good. Thanks Amazon.)   (As described)   (thanks)   (Ok)   (Legit 100% thank you)   (iPhone 14 its nice and i love it)   (I bought this after using iPhone 13 for 1 year and as a consumer)   ( I believe there is no huge difference between the same size 13 & 14. I would recommend you to buy the cheapest one if you cant decide between 13 & 14.),4.5 out of 5 stars,104 ratings,phone,[],[],['128']
"Xiaomi Poco F6 5G + 4G LTE 512GB + 12GB Global Version Unlocked 6.67"" 120Hz 50Mp Triple Camera (Tmobile Mint Tello & Global) + (w/Fast Car 51W Bundle) (Green)",20888,No Sale,https://m.media-amazon.com/images/I/516KMNsDvrL._AC_SX522_.jpg,(Brand : Name Xiaomi)   (Operating : System Android 13.0)   (Memory : Storage Capacity 512 GB)   (Screen : Size 6.67 Inches)   (Model : Name poco f6)   (Wireless : Provider Unlocked)   (Color : Green),"USA MARKET: Only Works on Tmobile - Mint - Tello - Lyca Mobile or any under Tmobile Network. GLOBAL Unlocked Dual Sim. 5G + 4G VoLTE Worldwide Unlocked Dual Nano sim . FCC ID: 2AFZZRKC6G, Dual SIM: 5G+5G / 5G + 4G 5G: SNetwork bands:Supports 5G* / 4G / 3G/ 2G5G Sub6G: /3/5/7/8/20/28/38/40/41/77/78 4G LTE FDD: /2/3/4/5/7/8/20/28/66(NarrowBand) 4G LTE TDD: B38/40/41/42/48 3G WCDMA: B1/2/4/5/8 2G Quad Band, 6.67"" CrystalRes 1.5K Flow AMOLED DotDisplayRefresh rate: Up to 120HzTouch sampling rate: Up to 480Hz touch sampling rate*, 2160Hz instant touch sampling rate* Brightness: 500 nits (typ), 1000-1200 nits (HBM brightness) , 2400 nits (peak brightness)Contrast ratio: 5,000,000:1Resolution: 2712 x 1220PPI:446100% DCI-P3 wide color gamut68 billion colors1920Hz PWM dimmingOriginal Color PROPro HDR display16x super resolution touchSunlight displayReading modeCycle modeCorning Gorilla Glass VictusDolby VisionHDR 10+TÜV Low Blue Light (Hardware Solution) CertificationTÜV Flicker Free CertificationTÜV Circadian Friendly Certification, Flagship Snapdragon 8s Gen 3 Mobile PlatformFlagship TSMC 4nm processCPU Octa-core processor, up to 3.0GHz 1x X4@3.0GHz+4x A720@2.8GHz+3x A520@2.0GHzGPU: Adreno GPUAI: Qualcomm AI Engine, 50MP main camera Sony IMX882f/1.591.6μm large pixel(4-in-1)6p8MP ultra-wide cameraIMX355Rear camera video recording4K video shooting: 30fps / 60fps1080p video shooting: 30fps / 60fps1080p slow motion video shooting: 120fps / 240fps720p video shooting: 30fps720p slow motion video shooting: 120fps / 240fpsRear camera video featuresSlow motionTime-lapse20MP front cameraOV20B(1/4"" sensor size)f/2.24p lensFront camera video recording1080p 1920x1080 | 60fps1080p 1920x1080 | 30fps720p 1280x720 | 30fps, GPS: L1 ｜GLONASS: G1 | Beidou: B1 | Galileo E1 | QZSS L1 Dual speakersSupports audio formats such as MP3，FLAC, APE，AAC, OGG, WAV, AMR, AWBDolby Atmos certificationHi-Res Audio certificationHi-Res Wireless Audio certification",(),No Rating,No Ratings,phone,[],['12'],['512']
Samsung Galaxy A54 Dual SIM 8GB Ram+128GB ROM (6.23 Inches) (5G) - (Awesome Graphite),16900,No Sale,https://m.media-amazon.com/images/I/71xU8w3fHJL._AC_SX522_.jpg,,"BODY Dimensions: 158.2 x 76.7 x 8.2 mm (6.23 x 3.02 x 0.32 in), DISPLAY Type: Super AMOLED, 120Hz, HDR10+, 1000 nits (HBM), PLATFORM OS: Android 13, One UI 5.1, MAIN CAMERA Triple: 50 MP, f/1.8, (wide), 1/1.56"", 1.0µm, PDAF, OIS - 12 MP, f/2.2, 123˚ (ultrawide), 1.12µm - 5 MP, f/2.4, (macro), BATTERY Type: Li-Po 5000 mAh, non-removable",(وصل فالموعد، العلبة مغلفة بالكامل بدون اي فتحات او خربشات فيها. ثاني تجربة ليا مع أجهزة سامسونج فالفئة المتوسطة ولا يوجد اي مشاكل واجهتها مع الجهاز الا مشكلة سخونة ضهر الجهاز الزجاجي الخلفي في فصل الصيف لكن فالعموم ملمس الجهاز فخم جدا للوهلة الأولى وبيتزحلق من اليد بسهولة فيجب تركيب جراب للضهر للتحكم بقوة فالجهاز ومنع انزلاقه. أنصح بشراءه بشدة.)   (الموبيل ممتاز ما شاء الله انصح كل الناس تشتريه لو بتدورعلى موبيل بشاشة حلوة وكاميرا تحفة ولو بتدور على موبيل بروسيسور اقوى للالعاب ومعاه شاحن يبقى دور على نوع تانى ملحوظة زى ماكل الناس اكدت الموبيل منشأ هندى ومكتوب خطأ على الموقع فيتنامى)   (حرارة عاليه جدا وبطارية سيئة جدا)   (كويس)   (ناس كتير في المراجعات كانوا بيتكلموا علي الحواف بتاعة الموبايل ، بس انا شايفها معقوله وحلوه. واغلب التطبيقات مش بتستخدم الشاشه كلها اصلا.  الموبايل شكله حلو وملمسه حلو والصوت مظبوط.  طول وعرض الشاشه مناسبين اوي ، ولا هو الموبايل الضخم ولا الصغير)   ( مريحه في مسكته ، ومناسب جدا.  ارخم حاجه بالنسبه ليا هو حوار الشاحن فعلا، معرفش أصلا هو المفروض استخدم معاه شاحن ايه وبستخدم الشاحن بتاع الموبايل القديم.  كنت مسترخم انه مش بيدعم غير السماعات ال wireless بس اشطا ، حاجه تتبلع ، بس حوار الشاحن دا هو اللي رخم فعلا.  بما ان دا اول موبايل من سامسونج استخدمه ، حابب اقول ان انا حبيت ال one ui وطريقة الاشعارات وأصوات ال notifications وطريقة استخدام theme.)   (Original and comes with local warranty)   ( seller amazon. Check seller before purchase as other sellers provide international warranty)   (الموبايل المثالي من حيث فئته السعريه هتاخد احسن قيمه مقابل السعر والكاميرات بتاعته ممتازه عجبتني اوي والبطارية لحد دلوقتي بيكفي معايا اليوم كامل وزياده)   (very good)   (Samsung has the potential to become a global leader in the mobile phone industry.)   (الشاشه رائعه وسرعه الاستجابه ممتازه والصور فيهاذا الجوال رائعه وايضا مشكله الحراره لقد حلت من قبل التحديثات التي اتت مع الوقت فمن الذي يريد ان يشتريه الان فلن تواجه مشكله مع الحراره وبالعكس سوف ترا ان الهاتف لايحدث فيه مشكله الحراره ولاكن هناك مشكله هيه الحواف الكبيره الموجوده على الشاشه بهاذا السعر يمكن ان تأكذ هاتف بحواف اصغر من ذا لك وشكرا هاذه كانت مراجعتي للهاتف A54 5G)   (The battery drains so fast)   ( 8 to 10 hours screen timing. It's awesome phone in very less price Overall look is good camera quality am satisfied with cost and the item)   (Good Mobile)   (Good),4.2 out of 5 stars,341 ratings,phone,['Dual SIM'],['8'],['128']
"Samsung Galaxy Z Flip5 Android Smartphone, 8GB RAM, 256GB ROM, Lavender - 1 Year Warranty",33333,43285.00,https://m.media-amazon.com/images/I/61XV1hG+m5L._AC_SX679_.jpg,(Brand : Name SAMSUNG)   (Operating : System Android 13.0)   (RAM : Memory Installed 8 GB)   (CPU : Speed 2.8 GHz)   (Memory : Storage Capacity 256 GB)   (Screen : Size 6.7 Inches),"OS : Android 13, One UI 5.1.1, Display Size: 6.7 inches, 102.0 cm2 (~85.9% screen-to-body ratio), Body Build: Plastic front (opened), glass back (Gorilla Glass Victus 2), aluminum frame, Internal Memory: 256 GB, Battery Type: Li-Po 3700 mAh, non-removable",(the screen is not flat 100% still the middle line appear)   (تليفون شيك أداء سريع بطارية أقل من المتوسط شريحة واحده للأسف)   (الجهاز دولي مش ضمان)   (جيد)   (VERY GOOD MOBILE AND SMOOTHY)   (The phone is just amazing catchs everyone's eye )   ( was really scared but glad to have made this purchase)   ( came with charging cable and that's all!)   (ممتاز)   (I am writing to express my disappointment with the Samsung Flip 5 mobile phone)   ( a product that I had high hopes for but which ultimately fell short of my expectations.  Upon acquiring the Samsung Flip 5)   ( I was initially drawn to its sleek design and promises of enhanced performance. However)   ( after several weeks of use)   ( I have encountered numerous issues that have left me frustrated and dissatisfied.  1. **Performance Issues**: The Samsung Flip 5 often lags and experiences slowdowns during basic tasks)   ( such as opening apps)   ( browsing the internet)   ( and multitasking. This significantly affects the user experience and productivity.  2. **Battery Life**: Despite claims of impressive battery life)   ( the Flip 5's battery drains quickly)   ( even with minimal usage. This necessitates frequent recharging)   ( which can be inconvenient when on the go.  3. **Camera Quality**: The camera performance)   ( particularly in lowlight conditions)   ( is subpar. The photos and videos captured lack clarity and sharpness)   ( failing to meet the expectations set by other devices in this price range.  4. **Software Updates**: I have encountered delays in receiving software updates and security patches)   ( which are crucial for maintaining the phone's performance and security. This lack of timely updates raises concerns about longterm support.  5. **Build Quality**: While the device is aesthetically pleasing)   ( it is not as durable as expected. It appears to be more susceptible to scratches and minor damage than other smartphones I have owned. Read more)   (Beautiful phone)   (اعجب بنتي كثير),4.1 out of 5 stars,94 ratings,phone,[],['8'],['256']
"Samsung Galaxy A54 - Dual SIM Mobile Phone Android, 8GB RAM, 128GB, 5G, Awesome Lime",15950,No Sale,https://m.media-amazon.com/images/I/61IajoQuBqL._AC_SX522_.jpg,,"BODY Dimensions: 158.2 x 76.7 x 8.2 mm (6.23 x 3.02 x 0.32 in), DISPLAY Type: Super AMOLED, 120Hz, HDR10+, 1000 nits (HBM), PLATFORM OS: Android 13, One UI 5.1, MAIN CAMERA Triple: 50 MP, f/1.8, (wide), 1/1.56"", 1.0µm, PDAF, OIS - 12 MP, f/2.2, 123˚ (ultrawide), 1.12µm - 5 MP, f/2.4, (macro), BATTERY Type: Li-Po 5000 mAh, non-removable",(انصح به)   (الجودة والموعد)   (نصيحة عامة لجميع الاصدقاء ليس هناك فرق بين فيتنامى ولا هندي كله يندرج تحت الشركة المصنعة سامسونج. الموبيل لقد اشتريته ولم اقوم بفتح العلبة من باب الامانة وتركتها مغلفة كما هى.لاننى قمت بشراءه اثناء فترة العرض بسعر ١٣٥٩٩. فقمت بعمل جوله للسؤال عليه ف المحلات لمعرفة سعره وجدت صدمه انه بثمن ١٢٠٠٠ ل ١٢٧٠٠. وعندها اخذت القرار كما هو لم افتح العلبة وقمت بارجاعة من باب الامانة. ونادرا جداااا ما اقوم بارجاع المنتجات التى اقوم بشراءها. شكرا لامازون.)   (هو أفضل من فى الفئة السعرية الخاص به لا يدعم غير الهاندفرى بلج اند بلاى)   (موبايل ممتاز جدا شركة سامسونج معروفة طبعا يكفي إنك هتاخد تحديثات 4سنوات لنظام التشغيل والسنة الخامسة للأمان الكاميرا يعتمد عليها جدا أنا اشتريته في عرض كويس جدا من أمازون أنصح به شكرا أمازون)   (انا طلبت تليفون سامسونج a54 واللى جالى ف الطرد باور بنك انكر والتليفون سعره 13600 وكلمت خدمه العملاء رفضت ترجعلى فلوسي أو التليفون اللى انا طلبته ودى اكبر دليل على أنها شركه نصابه)   (جيد)   (شكرا امازون علي سياسة الارجاع اشتريت الموبايل وقمت بارجاعه ليس إلا لحجمه الصغير فقط)   (Good)   (Been using the mobile for a year and does the job. Has nice camera)   (الأداء أروع مايكون ماشاءالله وكمان ميعلق ابدا لاكن فيه مشكلة بسيطة الي هي الحرارة انتبهو منها لاتشغلون الالعاب ثقيلة بس عايدي حملو مثلا زي Cole Duty Mobile بس معدل الإطار هو يكون عالي فقط اما جودة الرسومات لازم تكون أقل شي عشان لا يسخن الجوال وبس انشاءالله علمتكم كل شي الي يستفيد من تقيمي يحط لايك انا ما اجبر والله احد انه يحط او لايحط لايك سلام عليكم.)   (Warranty peper issue)   (Using almost 1 yr)   ( working good),4.3 out of 5 stars,220 ratings,phone,['Dual SIM'],['8'],['128']
Honor X7b 6-256 BLACK,8600,No Sale,https://m.media-amazon.com/images/I/51NKoR5aAgL._AC_SX679_.jpg,(Brand : Name HONOR)   (Operating : System Android 13.0)   (RAM : Memory Installed 6 GB)   (CPU : Model Snapdragon)   (Memory : Storage Capacity 256 GB)   (Screen : Size 6.8 Inches)   (Refresh : Rate 120 Hz),"Main Camera: 108MP Selfie Camera: 8MP, Battery: 6000mAH 33W Super charge, Display: 6.8 inch 90Hz Refresh rate",(),5.0 out of 5 stars,1 rating,phone,[],[],[]
